
         /\      Grafana   /‾‾/  
    /\  /  \     |\  __   /  /   
   /  \/    \    | |/ /  /   ‾‾\ 
  /          \   |   (  |  (‾)  |
 / __________ \  |_|\_\  \_____/ 

     execution: local
        script: load.js
        output: -

     scenarios: (100.00%) 1 scenario, 50 max VUs, 5m30s max duration (incl. graceful stop):
              * rps: 50.00 iterations/s for 5m0s (maxVUs: 20-50, gracefulStop: 30s)


running (0m01.0s), 00/20 VUs, 50 complete and 0 interrupted iterations
rps    [   0% ] 00/20 VUs  0m01.0s/5m0s  50.00 iters/s

running (0m02.0s), 00/20 VUs, 100 complete and 0 interrupted iterations
rps    [   1% ] 00/20 VUs  0m02.0s/5m0s  50.00 iters/s

running (0m03.0s), 00/20 VUs, 150 complete and 0 interrupted iterations
rps    [   1% ] 00/20 VUs  0m03.0s/5m0s  50.00 iters/s

running (0m04.0s), 00/20 VUs, 200 complete and 0 interrupted iterations
rps    [   1% ] 00/20 VUs  0m04.0s/5m0s  50.00 iters/s

running (0m05.0s), 00/20 VUs, 250 complete and 0 interrupted iterations
rps    [   2% ] 00/20 VUs  0m05.0s/5m0s  50.00 iters/s

running (0m06.0s), 00/20 VUs, 300 complete and 0 interrupted iterations
rps    [   2% ] 00/20 VUs  0m06.0s/5m0s  50.00 iters/s

running (0m07.0s), 00/20 VUs, 350 complete and 0 interrupted iterations
rps    [   2% ] 00/20 VUs  0m07.0s/5m0s  50.00 iters/s

running (0m08.0s), 00/20 VUs, 400 complete and 0 interrupted iterations
rps    [   3% ] 00/20 VUs  0m08.0s/5m0s  50.00 iters/s

running (0m09.0s), 00/20 VUs, 450 complete and 0 interrupted iterations
rps    [   3% ] 00/20 VUs  0m09.0s/5m0s  50.00 iters/s

running (0m10.0s), 00/20 VUs, 500 complete and 0 interrupted iterations
rps    [   3% ] 00/20 VUs  0m10.0s/5m0s  50.00 iters/s

running (0m11.0s), 00/20 VUs, 550 complete and 0 interrupted iterations
rps    [   4% ] 00/20 VUs  0m11.0s/5m0s  50.00 iters/s

running (0m12.0s), 00/20 VUs, 600 complete and 0 interrupted iterations
rps    [   4% ] 00/20 VUs  0m12.0s/5m0s  50.00 iters/s

running (0m13.0s), 00/20 VUs, 650 complete and 0 interrupted iterations
rps    [   4% ] 00/20 VUs  0m13.0s/5m0s  50.00 iters/s

running (0m14.0s), 00/20 VUs, 700 complete and 0 interrupted iterations
rps    [   5% ] 00/20 VUs  0m14.0s/5m0s  50.00 iters/s

running (0m15.0s), 00/20 VUs, 750 complete and 0 interrupted iterations
rps    [   5% ] 00/20 VUs  0m15.0s/5m0s  50.00 iters/s

running (0m16.0s), 00/20 VUs, 800 complete and 0 interrupted iterations
rps    [   5% ] 00/20 VUs  0m16.0s/5m0s  50.00 iters/s

running (0m17.0s), 00/20 VUs, 850 complete and 0 interrupted iterations
rps    [   6% ] 00/20 VUs  0m17.0s/5m0s  50.00 iters/s

running (0m18.0s), 00/20 VUs, 900 complete and 0 interrupted iterations
rps    [   6% ] 00/20 VUs  0m18.0s/5m0s  50.00 iters/s

running (0m19.0s), 00/20 VUs, 950 complete and 0 interrupted iterations
rps    [   6% ] 00/20 VUs  0m19.0s/5m0s  50.00 iters/s

running (0m20.0s), 00/20 VUs, 1000 complete and 0 interrupted iterations
rps    [   7% ] 00/20 VUs  0m20.0s/5m0s  50.00 iters/s

running (0m21.0s), 00/20 VUs, 1050 complete and 0 interrupted iterations
rps    [   7% ] 00/20 VUs  0m21.0s/5m0s  50.00 iters/s

running (0m22.0s), 00/20 VUs, 1100 complete and 0 interrupted iterations
rps    [   7% ] 00/20 VUs  0m22.0s/5m0s  50.00 iters/s

running (0m23.0s), 00/20 VUs, 1150 complete and 0 interrupted iterations
rps    [   8% ] 00/20 VUs  0m23.0s/5m0s  50.00 iters/s

running (0m24.0s), 00/20 VUs, 1200 complete and 0 interrupted iterations
rps    [   8% ] 00/20 VUs  0m24.0s/5m0s  50.00 iters/s

running (0m25.0s), 00/20 VUs, 1250 complete and 0 interrupted iterations
rps    [   8% ] 00/20 VUs  0m25.0s/5m0s  50.00 iters/s

running (0m26.0s), 00/20 VUs, 1300 complete and 0 interrupted iterations
rps    [   9% ] 00/20 VUs  0m26.0s/5m0s  50.00 iters/s

running (0m27.0s), 00/20 VUs, 1350 complete and 0 interrupted iterations
rps    [   9% ] 00/20 VUs  0m27.0s/5m0s  50.00 iters/s

running (0m28.0s), 00/20 VUs, 1400 complete and 0 interrupted iterations
rps    [   9% ] 00/20 VUs  0m28.0s/5m0s  50.00 iters/s

running (0m29.0s), 00/20 VUs, 1450 complete and 0 interrupted iterations
rps    [  10% ] 00/20 VUs  0m29.0s/5m0s  50.00 iters/s

running (0m30.0s), 00/20 VUs, 1500 complete and 0 interrupted iterations
rps    [  10% ] 00/20 VUs  0m30.0s/5m0s  50.00 iters/s

running (0m31.0s), 00/20 VUs, 1550 complete and 0 interrupted iterations
rps    [  10% ] 00/20 VUs  0m31.0s/5m0s  50.00 iters/s

running (0m32.0s), 00/20 VUs, 1600 complete and 0 interrupted iterations
rps    [  11% ] 00/20 VUs  0m32.0s/5m0s  50.00 iters/s

running (0m33.0s), 00/20 VUs, 1650 complete and 0 interrupted iterations
rps    [  11% ] 00/20 VUs  0m33.0s/5m0s  50.00 iters/s

running (0m34.0s), 00/20 VUs, 1700 complete and 0 interrupted iterations
rps    [  11% ] 00/20 VUs  0m34.0s/5m0s  50.00 iters/s

running (0m35.0s), 00/20 VUs, 1750 complete and 0 interrupted iterations
rps    [  12% ] 00/20 VUs  0m35.0s/5m0s  50.00 iters/s

running (0m36.0s), 00/20 VUs, 1800 complete and 0 interrupted iterations
rps    [  12% ] 00/20 VUs  0m36.0s/5m0s  50.00 iters/s

running (0m37.0s), 00/20 VUs, 1850 complete and 0 interrupted iterations
rps    [  12% ] 00/20 VUs  0m37.0s/5m0s  50.00 iters/s

running (0m38.0s), 00/20 VUs, 1900 complete and 0 interrupted iterations
rps    [  13% ] 00/20 VUs  0m38.0s/5m0s  50.00 iters/s

running (0m39.0s), 00/20 VUs, 1950 complete and 0 interrupted iterations
rps    [  13% ] 00/20 VUs  0m39.0s/5m0s  50.00 iters/s

running (0m40.0s), 00/20 VUs, 2000 complete and 0 interrupted iterations
rps    [  13% ] 00/20 VUs  0m40.0s/5m0s  50.00 iters/s

running (0m41.0s), 00/20 VUs, 2050 complete and 0 interrupted iterations
rps    [  14% ] 00/20 VUs  0m41.0s/5m0s  50.00 iters/s

running (0m42.0s), 00/20 VUs, 2100 complete and 0 interrupted iterations
rps    [  14% ] 00/20 VUs  0m42.0s/5m0s  50.00 iters/s

running (0m43.0s), 00/20 VUs, 2150 complete and 0 interrupted iterations
rps    [  14% ] 00/20 VUs  0m43.0s/5m0s  50.00 iters/s

running (0m44.0s), 00/20 VUs, 2200 complete and 0 interrupted iterations
rps    [  15% ] 00/20 VUs  0m44.0s/5m0s  50.00 iters/s

running (0m45.0s), 00/20 VUs, 2250 complete and 0 interrupted iterations
rps    [  15% ] 00/20 VUs  0m45.0s/5m0s  50.00 iters/s

running (0m46.0s), 00/20 VUs, 2300 complete and 0 interrupted iterations
rps    [  15% ] 00/20 VUs  0m46.0s/5m0s  50.00 iters/s

running (0m47.0s), 00/20 VUs, 2350 complete and 0 interrupted iterations
rps    [  16% ] 00/20 VUs  0m47.0s/5m0s  50.00 iters/s

running (0m48.0s), 00/20 VUs, 2400 complete and 0 interrupted iterations
rps    [  16% ] 00/20 VUs  0m48.0s/5m0s  50.00 iters/s

running (0m49.0s), 00/20 VUs, 2450 complete and 0 interrupted iterations
rps    [  16% ] 00/20 VUs  0m49.0s/5m0s  50.00 iters/s

running (0m50.0s), 00/20 VUs, 2500 complete and 0 interrupted iterations
rps    [  17% ] 00/20 VUs  0m50.0s/5m0s  50.00 iters/s

running (0m51.0s), 00/20 VUs, 2550 complete and 0 interrupted iterations
rps    [  17% ] 00/20 VUs  0m51.0s/5m0s  50.00 iters/s

running (0m52.0s), 00/20 VUs, 2600 complete and 0 interrupted iterations
rps    [  17% ] 00/20 VUs  0m52.0s/5m0s  50.00 iters/s

running (0m53.0s), 00/20 VUs, 2650 complete and 0 interrupted iterations
rps    [  18% ] 00/20 VUs  0m53.0s/5m0s  50.00 iters/s

running (0m54.0s), 00/20 VUs, 2700 complete and 0 interrupted iterations
rps    [  18% ] 00/20 VUs  0m54.0s/5m0s  50.00 iters/s

running (0m55.0s), 00/20 VUs, 2750 complete and 0 interrupted iterations
rps    [  18% ] 00/20 VUs  0m55.0s/5m0s  50.00 iters/s

running (0m56.0s), 00/20 VUs, 2800 complete and 0 interrupted iterations
rps    [  19% ] 00/20 VUs  0m56.0s/5m0s  50.00 iters/s

running (0m57.0s), 00/20 VUs, 2850 complete and 0 interrupted iterations
rps    [  19% ] 00/20 VUs  0m57.0s/5m0s  50.00 iters/s

running (0m58.0s), 00/20 VUs, 2900 complete and 0 interrupted iterations
rps    [  19% ] 00/20 VUs  0m58.0s/5m0s  50.00 iters/s

running (0m59.0s), 00/20 VUs, 2950 complete and 0 interrupted iterations
rps    [  20% ] 00/20 VUs  0m59.0s/5m0s  50.00 iters/s

running (1m00.0s), 00/20 VUs, 3000 complete and 0 interrupted iterations
rps    [  20% ] 00/20 VUs  1m00.0s/5m0s  50.00 iters/s

running (1m01.0s), 00/20 VUs, 3050 complete and 0 interrupted iterations
rps    [  20% ] 00/20 VUs  1m01.0s/5m0s  50.00 iters/s

running (1m02.0s), 00/20 VUs, 3100 complete and 0 interrupted iterations
rps    [  21% ] 00/20 VUs  1m02.0s/5m0s  50.00 iters/s

running (1m03.0s), 00/20 VUs, 3150 complete and 0 interrupted iterations
rps    [  21% ] 00/20 VUs  1m03.0s/5m0s  50.00 iters/s

running (1m04.0s), 00/20 VUs, 3200 complete and 0 interrupted iterations
rps    [  21% ] 00/20 VUs  1m04.0s/5m0s  50.00 iters/s

running (1m05.0s), 00/20 VUs, 3250 complete and 0 interrupted iterations
rps    [  22% ] 00/20 VUs  1m05.0s/5m0s  50.00 iters/s

running (1m06.0s), 00/20 VUs, 3300 complete and 0 interrupted iterations
rps    [  22% ] 00/20 VUs  1m06.0s/5m0s  50.00 iters/s

running (1m07.0s), 00/20 VUs, 3350 complete and 0 interrupted iterations
rps    [  22% ] 00/20 VUs  1m07.0s/5m0s  50.00 iters/s

running (1m08.0s), 00/20 VUs, 3400 complete and 0 interrupted iterations
rps    [  23% ] 00/20 VUs  1m08.0s/5m0s  50.00 iters/s

running (1m09.0s), 00/20 VUs, 3450 complete and 0 interrupted iterations
rps    [  23% ] 00/20 VUs  1m09.0s/5m0s  50.00 iters/s

running (1m10.0s), 00/20 VUs, 3500 complete and 0 interrupted iterations
rps    [  23% ] 00/20 VUs  1m10.0s/5m0s  50.00 iters/s

running (1m11.0s), 00/20 VUs, 3550 complete and 0 interrupted iterations
rps    [  24% ] 00/20 VUs  1m11.0s/5m0s  50.00 iters/s

running (1m12.0s), 00/20 VUs, 3600 complete and 0 interrupted iterations
rps    [  24% ] 00/20 VUs  1m12.0s/5m0s  50.00 iters/s

running (1m13.0s), 00/20 VUs, 3650 complete and 0 interrupted iterations
rps    [  24% ] 00/20 VUs  1m13.0s/5m0s  50.00 iters/s

running (1m14.0s), 00/20 VUs, 3700 complete and 0 interrupted iterations
rps    [  25% ] 00/20 VUs  1m14.0s/5m0s  50.00 iters/s

running (1m15.0s), 00/20 VUs, 3750 complete and 0 interrupted iterations
rps    [  25% ] 00/20 VUs  1m15.0s/5m0s  50.00 iters/s

running (1m16.0s), 00/20 VUs, 3800 complete and 0 interrupted iterations
rps    [  25% ] 00/20 VUs  1m16.0s/5m0s  50.00 iters/s

running (1m17.0s), 00/20 VUs, 3850 complete and 0 interrupted iterations
rps    [  26% ] 00/20 VUs  1m17.0s/5m0s  50.00 iters/s

running (1m18.0s), 00/20 VUs, 3900 complete and 0 interrupted iterations
rps    [  26% ] 00/20 VUs  1m18.0s/5m0s  50.00 iters/s

running (1m19.0s), 00/20 VUs, 3950 complete and 0 interrupted iterations
rps    [  26% ] 00/20 VUs  1m19.0s/5m0s  50.00 iters/s

running (1m20.0s), 00/20 VUs, 4000 complete and 0 interrupted iterations
rps    [  27% ] 00/20 VUs  1m20.0s/5m0s  50.00 iters/s

running (1m21.0s), 00/20 VUs, 4050 complete and 0 interrupted iterations
rps    [  27% ] 00/20 VUs  1m21.0s/5m0s  50.00 iters/s

running (1m22.0s), 00/20 VUs, 4100 complete and 0 interrupted iterations
rps    [  27% ] 00/20 VUs  1m22.0s/5m0s  50.00 iters/s

running (1m23.0s), 00/20 VUs, 4150 complete and 0 interrupted iterations
rps    [  28% ] 00/20 VUs  1m23.0s/5m0s  50.00 iters/s

running (1m24.0s), 00/20 VUs, 4200 complete and 0 interrupted iterations
rps    [  28% ] 00/20 VUs  1m24.0s/5m0s  50.00 iters/s

running (1m25.0s), 00/20 VUs, 4250 complete and 0 interrupted iterations
rps    [  28% ] 00/20 VUs  1m25.0s/5m0s  50.00 iters/s

running (1m26.0s), 00/20 VUs, 4300 complete and 0 interrupted iterations
rps    [  29% ] 00/20 VUs  1m26.0s/5m0s  50.00 iters/s

running (1m27.0s), 00/20 VUs, 4350 complete and 0 interrupted iterations
rps    [  29% ] 00/20 VUs  1m27.0s/5m0s  50.00 iters/s

running (1m28.0s), 00/20 VUs, 4400 complete and 0 interrupted iterations
rps    [  29% ] 00/20 VUs  1m28.0s/5m0s  50.00 iters/s

running (1m29.0s), 00/20 VUs, 4450 complete and 0 interrupted iterations
rps    [  30% ] 00/20 VUs  1m29.0s/5m0s  50.00 iters/s

running (1m30.0s), 00/20 VUs, 4500 complete and 0 interrupted iterations
rps    [  30% ] 00/20 VUs  1m30.0s/5m0s  50.00 iters/s

running (1m31.0s), 00/20 VUs, 4550 complete and 0 interrupted iterations
rps    [  30% ] 00/20 VUs  1m31.0s/5m0s  50.00 iters/s

running (1m32.0s), 00/20 VUs, 4600 complete and 0 interrupted iterations
rps    [  31% ] 00/20 VUs  1m32.0s/5m0s  50.00 iters/s

running (1m33.0s), 00/20 VUs, 4650 complete and 0 interrupted iterations
rps    [  31% ] 00/20 VUs  1m33.0s/5m0s  50.00 iters/s

running (1m34.0s), 00/20 VUs, 4700 complete and 0 interrupted iterations
rps    [  31% ] 00/20 VUs  1m34.0s/5m0s  50.00 iters/s

running (1m35.0s), 00/20 VUs, 4750 complete and 0 interrupted iterations
rps    [  32% ] 00/20 VUs  1m35.0s/5m0s  50.00 iters/s

running (1m36.0s), 00/20 VUs, 4800 complete and 0 interrupted iterations
rps    [  32% ] 00/20 VUs  1m36.0s/5m0s  50.00 iters/s

running (1m37.0s), 00/20 VUs, 4850 complete and 0 interrupted iterations
rps    [  32% ] 00/20 VUs  1m37.0s/5m0s  50.00 iters/s

running (1m38.0s), 00/20 VUs, 4900 complete and 0 interrupted iterations
rps    [  33% ] 00/20 VUs  1m38.0s/5m0s  50.00 iters/s

running (1m39.0s), 00/20 VUs, 4950 complete and 0 interrupted iterations
rps    [  33% ] 00/20 VUs  1m39.0s/5m0s  50.00 iters/s

running (1m40.0s), 00/20 VUs, 5000 complete and 0 interrupted iterations
rps    [  33% ] 00/20 VUs  1m40.0s/5m0s  50.00 iters/s

running (1m41.0s), 00/20 VUs, 5050 complete and 0 interrupted iterations
rps    [  34% ] 00/20 VUs  1m41.0s/5m0s  50.00 iters/s

running (1m42.0s), 00/20 VUs, 5100 complete and 0 interrupted iterations
rps    [  34% ] 00/20 VUs  1m42.0s/5m0s  50.00 iters/s

running (1m43.0s), 00/20 VUs, 5150 complete and 0 interrupted iterations
rps    [  34% ] 00/20 VUs  1m43.0s/5m0s  50.00 iters/s

running (1m44.0s), 00/20 VUs, 5200 complete and 0 interrupted iterations
rps    [  35% ] 00/20 VUs  1m44.0s/5m0s  50.00 iters/s

running (1m45.0s), 00/20 VUs, 5250 complete and 0 interrupted iterations
rps    [  35% ] 00/20 VUs  1m45.0s/5m0s  50.00 iters/s

running (1m46.0s), 00/20 VUs, 5300 complete and 0 interrupted iterations
rps    [  35% ] 00/20 VUs  1m46.0s/5m0s  50.00 iters/s

running (1m47.0s), 00/20 VUs, 5350 complete and 0 interrupted iterations
rps    [  36% ] 00/20 VUs  1m47.0s/5m0s  50.00 iters/s

running (1m48.0s), 00/20 VUs, 5400 complete and 0 interrupted iterations
rps    [  36% ] 00/20 VUs  1m48.0s/5m0s  50.00 iters/s

running (1m49.0s), 00/20 VUs, 5450 complete and 0 interrupted iterations
rps    [  36% ] 00/20 VUs  1m49.0s/5m0s  50.00 iters/s

running (1m50.0s), 00/20 VUs, 5500 complete and 0 interrupted iterations
rps    [  37% ] 00/20 VUs  1m50.0s/5m0s  50.00 iters/s

running (1m51.0s), 00/20 VUs, 5550 complete and 0 interrupted iterations
rps    [  37% ] 00/20 VUs  1m51.0s/5m0s  50.00 iters/s

running (1m52.0s), 00/20 VUs, 5600 complete and 0 interrupted iterations
rps    [  37% ] 00/20 VUs  1m52.0s/5m0s  50.00 iters/s

running (1m53.0s), 00/20 VUs, 5650 complete and 0 interrupted iterations
rps    [  38% ] 00/20 VUs  1m53.0s/5m0s  50.00 iters/s

running (1m54.0s), 00/20 VUs, 5700 complete and 0 interrupted iterations
rps    [  38% ] 00/20 VUs  1m54.0s/5m0s  50.00 iters/s

running (1m55.0s), 00/20 VUs, 5750 complete and 0 interrupted iterations
rps    [  38% ] 00/20 VUs  1m55.0s/5m0s  50.00 iters/s

running (1m56.0s), 00/20 VUs, 5800 complete and 0 interrupted iterations
rps    [  39% ] 00/20 VUs  1m56.0s/5m0s  50.00 iters/s

running (1m57.0s), 00/20 VUs, 5850 complete and 0 interrupted iterations
rps    [  39% ] 00/20 VUs  1m57.0s/5m0s  50.00 iters/s

running (1m58.0s), 00/20 VUs, 5900 complete and 0 interrupted iterations
rps    [  39% ] 00/20 VUs  1m58.0s/5m0s  50.00 iters/s

running (1m59.0s), 00/20 VUs, 5950 complete and 0 interrupted iterations
rps    [  40% ] 00/20 VUs  1m59.0s/5m0s  50.00 iters/s

running (2m00.0s), 00/20 VUs, 6000 complete and 0 interrupted iterations
rps    [  40% ] 00/20 VUs  2m00.0s/5m0s  50.00 iters/s

running (2m01.0s), 00/20 VUs, 6050 complete and 0 interrupted iterations
rps    [  40% ] 00/20 VUs  2m01.0s/5m0s  50.00 iters/s

running (2m02.0s), 00/20 VUs, 6100 complete and 0 interrupted iterations
rps    [  41% ] 00/20 VUs  2m02.0s/5m0s  50.00 iters/s

running (2m03.0s), 00/20 VUs, 6150 complete and 0 interrupted iterations
rps    [  41% ] 00/20 VUs  2m03.0s/5m0s  50.00 iters/s

running (2m04.0s), 00/20 VUs, 6200 complete and 0 interrupted iterations
rps    [  41% ] 00/20 VUs  2m04.0s/5m0s  50.00 iters/s

running (2m05.0s), 00/20 VUs, 6250 complete and 0 interrupted iterations
rps    [  42% ] 00/20 VUs  2m05.0s/5m0s  50.00 iters/s

running (2m06.0s), 00/20 VUs, 6300 complete and 0 interrupted iterations
rps    [  42% ] 00/20 VUs  2m06.0s/5m0s  50.00 iters/s

running (2m07.0s), 00/20 VUs, 6350 complete and 0 interrupted iterations
rps    [  42% ] 00/20 VUs  2m07.0s/5m0s  50.00 iters/s

running (2m08.0s), 00/20 VUs, 6400 complete and 0 interrupted iterations
rps    [  43% ] 00/20 VUs  2m08.0s/5m0s  50.00 iters/s

running (2m09.0s), 00/20 VUs, 6450 complete and 0 interrupted iterations
rps    [  43% ] 00/20 VUs  2m09.0s/5m0s  50.00 iters/s

running (2m10.0s), 00/20 VUs, 6500 complete and 0 interrupted iterations
rps    [  43% ] 00/20 VUs  2m10.0s/5m0s  50.00 iters/s

running (2m11.0s), 00/20 VUs, 6550 complete and 0 interrupted iterations
rps    [  44% ] 00/20 VUs  2m11.0s/5m0s  50.00 iters/s

running (2m12.0s), 00/20 VUs, 6600 complete and 0 interrupted iterations
rps    [  44% ] 00/20 VUs  2m12.0s/5m0s  50.00 iters/s

running (2m13.0s), 00/20 VUs, 6650 complete and 0 interrupted iterations
rps    [  44% ] 00/20 VUs  2m13.0s/5m0s  50.00 iters/s

running (2m14.0s), 00/20 VUs, 6700 complete and 0 interrupted iterations
rps    [  45% ] 00/20 VUs  2m14.0s/5m0s  50.00 iters/s

running (2m15.0s), 00/20 VUs, 6750 complete and 0 interrupted iterations
rps    [  45% ] 00/20 VUs  2m15.0s/5m0s  50.00 iters/s

running (2m16.0s), 00/20 VUs, 6800 complete and 0 interrupted iterations
rps    [  45% ] 00/20 VUs  2m16.0s/5m0s  50.00 iters/s

running (2m17.0s), 00/20 VUs, 6850 complete and 0 interrupted iterations
rps    [  46% ] 00/20 VUs  2m17.0s/5m0s  50.00 iters/s

running (2m18.0s), 00/20 VUs, 6900 complete and 0 interrupted iterations
rps    [  46% ] 00/20 VUs  2m18.0s/5m0s  50.00 iters/s

running (2m19.0s), 00/20 VUs, 6950 complete and 0 interrupted iterations
rps    [  46% ] 00/20 VUs  2m19.0s/5m0s  50.00 iters/s

running (2m20.0s), 00/20 VUs, 7000 complete and 0 interrupted iterations
rps    [  47% ] 00/20 VUs  2m20.0s/5m0s  50.00 iters/s

running (2m21.0s), 00/20 VUs, 7050 complete and 0 interrupted iterations
rps    [  47% ] 00/20 VUs  2m21.0s/5m0s  50.00 iters/s

running (2m22.0s), 00/20 VUs, 7100 complete and 0 interrupted iterations
rps    [  47% ] 00/20 VUs  2m22.0s/5m0s  50.00 iters/s

running (2m23.0s), 00/20 VUs, 7150 complete and 0 interrupted iterations
rps    [  48% ] 00/20 VUs  2m23.0s/5m0s  50.00 iters/s

running (2m24.0s), 00/20 VUs, 7200 complete and 0 interrupted iterations
rps    [  48% ] 00/20 VUs  2m24.0s/5m0s  50.00 iters/s

running (2m25.0s), 00/20 VUs, 7250 complete and 0 interrupted iterations
rps    [  48% ] 00/20 VUs  2m25.0s/5m0s  50.00 iters/s

running (2m26.0s), 00/20 VUs, 7300 complete and 0 interrupted iterations
rps    [  49% ] 00/20 VUs  2m26.0s/5m0s  50.00 iters/s

running (2m27.0s), 00/20 VUs, 7350 complete and 0 interrupted iterations
rps    [  49% ] 00/20 VUs  2m27.0s/5m0s  50.00 iters/s

running (2m28.0s), 00/20 VUs, 7400 complete and 0 interrupted iterations
rps    [  49% ] 00/20 VUs  2m28.0s/5m0s  50.00 iters/s

running (2m29.0s), 00/20 VUs, 7450 complete and 0 interrupted iterations
rps    [  50% ] 00/20 VUs  2m29.0s/5m0s  50.00 iters/s

running (2m30.0s), 00/20 VUs, 7500 complete and 0 interrupted iterations
rps    [  50% ] 00/20 VUs  2m30.0s/5m0s  50.00 iters/s

running (2m31.0s), 00/20 VUs, 7550 complete and 0 interrupted iterations
rps    [  50% ] 00/20 VUs  2m31.0s/5m0s  50.00 iters/s

running (2m32.0s), 00/20 VUs, 7600 complete and 0 interrupted iterations
rps    [  51% ] 00/20 VUs  2m32.0s/5m0s  50.00 iters/s

running (2m33.0s), 00/20 VUs, 7650 complete and 0 interrupted iterations
rps    [  51% ] 00/20 VUs  2m33.0s/5m0s  50.00 iters/s

running (2m34.0s), 00/20 VUs, 7700 complete and 0 interrupted iterations
rps    [  51% ] 00/20 VUs  2m34.0s/5m0s  50.00 iters/s

running (2m35.0s), 00/20 VUs, 7750 complete and 0 interrupted iterations
rps    [  52% ] 00/20 VUs  2m35.0s/5m0s  50.00 iters/s

running (2m36.0s), 00/20 VUs, 7800 complete and 0 interrupted iterations
rps    [  52% ] 00/20 VUs  2m36.0s/5m0s  50.00 iters/s

running (2m37.0s), 00/20 VUs, 7850 complete and 0 interrupted iterations
rps    [  52% ] 00/20 VUs  2m37.0s/5m0s  50.00 iters/s

running (2m38.0s), 00/20 VUs, 7900 complete and 0 interrupted iterations
rps    [  53% ] 00/20 VUs  2m38.0s/5m0s  50.00 iters/s

running (2m39.0s), 00/20 VUs, 7950 complete and 0 interrupted iterations
rps    [  53% ] 00/20 VUs  2m39.0s/5m0s  50.00 iters/s

running (2m40.0s), 00/20 VUs, 8000 complete and 0 interrupted iterations
rps    [  53% ] 00/20 VUs  2m40.0s/5m0s  50.00 iters/s

running (2m41.0s), 00/20 VUs, 8050 complete and 0 interrupted iterations
rps    [  54% ] 00/20 VUs  2m41.0s/5m0s  50.00 iters/s

running (2m42.0s), 00/20 VUs, 8100 complete and 0 interrupted iterations
rps    [  54% ] 00/20 VUs  2m42.0s/5m0s  50.00 iters/s

running (2m43.0s), 00/20 VUs, 8150 complete and 0 interrupted iterations
rps    [  54% ] 00/20 VUs  2m43.0s/5m0s  50.00 iters/s

running (2m44.0s), 00/20 VUs, 8200 complete and 0 interrupted iterations
rps    [  55% ] 00/20 VUs  2m44.0s/5m0s  50.00 iters/s

running (2m45.0s), 00/20 VUs, 8250 complete and 0 interrupted iterations
rps    [  55% ] 00/20 VUs  2m45.0s/5m0s  50.00 iters/s

running (2m46.0s), 00/20 VUs, 8300 complete and 0 interrupted iterations
rps    [  55% ] 00/20 VUs  2m46.0s/5m0s  50.00 iters/s

running (2m47.0s), 00/20 VUs, 8350 complete and 0 interrupted iterations
rps    [  56% ] 00/20 VUs  2m47.0s/5m0s  50.00 iters/s

running (2m48.0s), 00/20 VUs, 8400 complete and 0 interrupted iterations
rps    [  56% ] 00/20 VUs  2m48.0s/5m0s  50.00 iters/s

running (2m49.0s), 00/20 VUs, 8450 complete and 0 interrupted iterations
rps    [  56% ] 00/20 VUs  2m49.0s/5m0s  50.00 iters/s

running (2m50.0s), 00/20 VUs, 8500 complete and 0 interrupted iterations
rps    [  57% ] 00/20 VUs  2m50.0s/5m0s  50.00 iters/s

running (2m51.0s), 00/20 VUs, 8550 complete and 0 interrupted iterations
rps    [  57% ] 00/20 VUs  2m51.0s/5m0s  50.00 iters/s

running (2m52.0s), 00/20 VUs, 8600 complete and 0 interrupted iterations
rps    [  57% ] 00/20 VUs  2m52.0s/5m0s  50.00 iters/s

running (2m53.0s), 00/20 VUs, 8650 complete and 0 interrupted iterations
rps    [  58% ] 00/20 VUs  2m53.0s/5m0s  50.00 iters/s

running (2m54.0s), 00/20 VUs, 8700 complete and 0 interrupted iterations
rps    [  58% ] 00/20 VUs  2m54.0s/5m0s  50.00 iters/s

running (2m55.0s), 00/20 VUs, 8750 complete and 0 interrupted iterations
rps    [  58% ] 00/20 VUs  2m55.0s/5m0s  50.00 iters/s

running (2m56.0s), 00/20 VUs, 8800 complete and 0 interrupted iterations
rps    [  59% ] 00/20 VUs  2m56.0s/5m0s  50.00 iters/s

running (2m57.0s), 00/20 VUs, 8850 complete and 0 interrupted iterations
rps    [  59% ] 00/20 VUs  2m57.0s/5m0s  50.00 iters/s

running (2m58.0s), 00/20 VUs, 8900 complete and 0 interrupted iterations
rps    [  59% ] 00/20 VUs  2m58.0s/5m0s  50.00 iters/s

running (2m59.0s), 00/20 VUs, 8950 complete and 0 interrupted iterations
rps    [  60% ] 00/20 VUs  2m59.0s/5m0s  50.00 iters/s

running (3m00.0s), 00/20 VUs, 9000 complete and 0 interrupted iterations
rps    [  60% ] 00/20 VUs  3m00.0s/5m0s  50.00 iters/s

running (3m01.0s), 00/20 VUs, 9050 complete and 0 interrupted iterations
rps    [  60% ] 00/20 VUs  3m01.0s/5m0s  50.00 iters/s

running (3m02.0s), 00/20 VUs, 9100 complete and 0 interrupted iterations
rps    [  61% ] 00/20 VUs  3m02.0s/5m0s  50.00 iters/s

running (3m03.0s), 00/20 VUs, 9150 complete and 0 interrupted iterations
rps    [  61% ] 00/20 VUs  3m03.0s/5m0s  50.00 iters/s

running (3m04.0s), 00/20 VUs, 9200 complete and 0 interrupted iterations
rps    [  61% ] 00/20 VUs  3m04.0s/5m0s  50.00 iters/s

running (3m05.0s), 00/20 VUs, 9250 complete and 0 interrupted iterations
rps    [  62% ] 00/20 VUs  3m05.0s/5m0s  50.00 iters/s

running (3m06.0s), 00/20 VUs, 9300 complete and 0 interrupted iterations
rps    [  62% ] 00/20 VUs  3m06.0s/5m0s  50.00 iters/s

running (3m07.0s), 00/20 VUs, 9350 complete and 0 interrupted iterations
rps    [  62% ] 00/20 VUs  3m07.0s/5m0s  50.00 iters/s

running (3m08.0s), 00/20 VUs, 9400 complete and 0 interrupted iterations
rps    [  63% ] 00/20 VUs  3m08.0s/5m0s  50.00 iters/s

running (3m09.0s), 00/20 VUs, 9450 complete and 0 interrupted iterations
rps    [  63% ] 00/20 VUs  3m09.0s/5m0s  50.00 iters/s

running (3m10.0s), 00/20 VUs, 9500 complete and 0 interrupted iterations
rps    [  63% ] 00/20 VUs  3m10.0s/5m0s  50.00 iters/s

running (3m11.0s), 00/20 VUs, 9550 complete and 0 interrupted iterations
rps    [  64% ] 00/20 VUs  3m11.0s/5m0s  50.00 iters/s

running (3m12.0s), 00/20 VUs, 9600 complete and 0 interrupted iterations
rps    [  64% ] 00/20 VUs  3m12.0s/5m0s  50.00 iters/s

running (3m13.0s), 00/20 VUs, 9650 complete and 0 interrupted iterations
rps    [  64% ] 00/20 VUs  3m13.0s/5m0s  50.00 iters/s

running (3m14.0s), 00/20 VUs, 9700 complete and 0 interrupted iterations
rps    [  65% ] 00/20 VUs  3m14.0s/5m0s  50.00 iters/s

running (3m15.0s), 00/20 VUs, 9750 complete and 0 interrupted iterations
rps    [  65% ] 00/20 VUs  3m15.0s/5m0s  50.00 iters/s

running (3m16.0s), 00/20 VUs, 9800 complete and 0 interrupted iterations
rps    [  65% ] 00/20 VUs  3m16.0s/5m0s  50.00 iters/s

running (3m17.0s), 00/20 VUs, 9850 complete and 0 interrupted iterations
rps    [  66% ] 00/20 VUs  3m17.0s/5m0s  50.00 iters/s

running (3m18.0s), 00/20 VUs, 9900 complete and 0 interrupted iterations
rps    [  66% ] 00/20 VUs  3m18.0s/5m0s  50.00 iters/s

running (3m19.0s), 00/20 VUs, 9950 complete and 0 interrupted iterations
rps    [  66% ] 00/20 VUs  3m19.0s/5m0s  50.00 iters/s

running (3m20.0s), 00/20 VUs, 10000 complete and 0 interrupted iterations
rps    [  67% ] 00/20 VUs  3m20.0s/5m0s  50.00 iters/s

running (3m21.0s), 00/20 VUs, 10050 complete and 0 interrupted iterations
rps    [  67% ] 00/20 VUs  3m21.0s/5m0s  50.00 iters/s

running (3m22.0s), 00/20 VUs, 10100 complete and 0 interrupted iterations
rps    [  67% ] 00/20 VUs  3m22.0s/5m0s  50.00 iters/s

running (3m23.0s), 00/20 VUs, 10150 complete and 0 interrupted iterations
rps    [  68% ] 00/20 VUs  3m23.0s/5m0s  50.00 iters/s

running (3m24.0s), 00/20 VUs, 10200 complete and 0 interrupted iterations
rps    [  68% ] 00/20 VUs  3m24.0s/5m0s  50.00 iters/s

running (3m25.0s), 00/20 VUs, 10250 complete and 0 interrupted iterations
rps    [  68% ] 00/20 VUs  3m25.0s/5m0s  50.00 iters/s

running (3m26.0s), 00/20 VUs, 10300 complete and 0 interrupted iterations
rps    [  69% ] 00/20 VUs  3m26.0s/5m0s  50.00 iters/s

running (3m27.0s), 00/20 VUs, 10350 complete and 0 interrupted iterations
rps    [  69% ] 00/20 VUs  3m27.0s/5m0s  50.00 iters/s

running (3m28.0s), 00/20 VUs, 10400 complete and 0 interrupted iterations
rps    [  69% ] 00/20 VUs  3m28.0s/5m0s  50.00 iters/s

running (3m29.0s), 00/20 VUs, 10450 complete and 0 interrupted iterations
rps    [  70% ] 00/20 VUs  3m29.0s/5m0s  50.00 iters/s

running (3m30.0s), 00/20 VUs, 10500 complete and 0 interrupted iterations
rps    [  70% ] 00/20 VUs  3m30.0s/5m0s  50.00 iters/s

running (3m31.0s), 00/20 VUs, 10550 complete and 0 interrupted iterations
rps    [  70% ] 00/20 VUs  3m31.0s/5m0s  50.00 iters/s

running (3m32.0s), 00/20 VUs, 10600 complete and 0 interrupted iterations
rps    [  71% ] 00/20 VUs  3m32.0s/5m0s  50.00 iters/s

running (3m33.0s), 00/20 VUs, 10650 complete and 0 interrupted iterations
rps    [  71% ] 00/20 VUs  3m33.0s/5m0s  50.00 iters/s

running (3m34.0s), 00/20 VUs, 10700 complete and 0 interrupted iterations
rps    [  71% ] 00/20 VUs  3m34.0s/5m0s  50.00 iters/s

running (3m35.0s), 00/20 VUs, 10750 complete and 0 interrupted iterations
rps    [  72% ] 00/20 VUs  3m35.0s/5m0s  50.00 iters/s

running (3m36.0s), 00/20 VUs, 10800 complete and 0 interrupted iterations
rps    [  72% ] 00/20 VUs  3m36.0s/5m0s  50.00 iters/s

running (3m37.0s), 00/20 VUs, 10850 complete and 0 interrupted iterations
rps    [  72% ] 00/20 VUs  3m37.0s/5m0s  50.00 iters/s

running (3m38.0s), 00/20 VUs, 10900 complete and 0 interrupted iterations
rps    [  73% ] 00/20 VUs  3m38.0s/5m0s  50.00 iters/s

running (3m39.0s), 00/20 VUs, 10950 complete and 0 interrupted iterations
rps    [  73% ] 00/20 VUs  3m39.0s/5m0s  50.00 iters/s

running (3m40.0s), 00/20 VUs, 11000 complete and 0 interrupted iterations
rps    [  73% ] 00/20 VUs  3m40.0s/5m0s  50.00 iters/s

running (3m41.0s), 00/20 VUs, 11050 complete and 0 interrupted iterations
rps    [  74% ] 00/20 VUs  3m41.0s/5m0s  50.00 iters/s

running (3m42.0s), 00/20 VUs, 11100 complete and 0 interrupted iterations
rps    [  74% ] 00/20 VUs  3m42.0s/5m0s  50.00 iters/s

running (3m43.0s), 00/20 VUs, 11150 complete and 0 interrupted iterations
rps    [  74% ] 00/20 VUs  3m43.0s/5m0s  50.00 iters/s

running (3m44.0s), 00/20 VUs, 11200 complete and 0 interrupted iterations
rps    [  75% ] 00/20 VUs  3m44.0s/5m0s  50.00 iters/s

running (3m45.0s), 00/20 VUs, 11250 complete and 0 interrupted iterations
rps    [  75% ] 00/20 VUs  3m45.0s/5m0s  50.00 iters/s

running (3m46.0s), 00/20 VUs, 11300 complete and 0 interrupted iterations
rps    [  75% ] 00/20 VUs  3m46.0s/5m0s  50.00 iters/s

running (3m47.0s), 00/20 VUs, 11350 complete and 0 interrupted iterations
rps    [  76% ] 00/20 VUs  3m47.0s/5m0s  50.00 iters/s

running (3m48.0s), 00/20 VUs, 11400 complete and 0 interrupted iterations
rps    [  76% ] 00/20 VUs  3m48.0s/5m0s  50.00 iters/s

running (3m49.0s), 00/20 VUs, 11450 complete and 0 interrupted iterations
rps    [  76% ] 00/20 VUs  3m49.0s/5m0s  50.00 iters/s

running (3m50.0s), 00/20 VUs, 11500 complete and 0 interrupted iterations
rps    [  77% ] 00/20 VUs  3m50.0s/5m0s  50.00 iters/s

running (3m51.0s), 00/20 VUs, 11550 complete and 0 interrupted iterations
rps    [  77% ] 00/20 VUs  3m51.0s/5m0s  50.00 iters/s

running (3m52.0s), 00/20 VUs, 11600 complete and 0 interrupted iterations
rps    [  77% ] 00/20 VUs  3m52.0s/5m0s  50.00 iters/s

running (3m53.0s), 00/20 VUs, 11650 complete and 0 interrupted iterations
rps    [  78% ] 00/20 VUs  3m53.0s/5m0s  50.00 iters/s

running (3m54.0s), 00/20 VUs, 11700 complete and 0 interrupted iterations
rps    [  78% ] 00/20 VUs  3m54.0s/5m0s  50.00 iters/s

running (3m55.0s), 00/20 VUs, 11750 complete and 0 interrupted iterations
rps    [  78% ] 00/20 VUs  3m55.0s/5m0s  50.00 iters/s

running (3m56.0s), 00/20 VUs, 11800 complete and 0 interrupted iterations
rps    [  79% ] 00/20 VUs  3m56.0s/5m0s  50.00 iters/s

running (3m57.0s), 00/20 VUs, 11850 complete and 0 interrupted iterations
rps    [  79% ] 00/20 VUs  3m57.0s/5m0s  50.00 iters/s

running (3m58.0s), 00/20 VUs, 11900 complete and 0 interrupted iterations
rps    [  79% ] 00/20 VUs  3m58.0s/5m0s  50.00 iters/s

running (3m59.0s), 00/20 VUs, 11950 complete and 0 interrupted iterations
rps    [  80% ] 00/20 VUs  3m59.0s/5m0s  50.00 iters/s

running (4m00.0s), 00/20 VUs, 12000 complete and 0 interrupted iterations
rps    [  80% ] 00/20 VUs  4m00.0s/5m0s  50.00 iters/s

running (4m01.0s), 00/20 VUs, 12050 complete and 0 interrupted iterations
rps    [  80% ] 00/20 VUs  4m01.0s/5m0s  50.00 iters/s

running (4m02.0s), 00/20 VUs, 12100 complete and 0 interrupted iterations
rps    [  81% ] 00/20 VUs  4m02.0s/5m0s  50.00 iters/s

running (4m03.0s), 00/20 VUs, 12150 complete and 0 interrupted iterations
rps    [  81% ] 00/20 VUs  4m03.0s/5m0s  50.00 iters/s

running (4m04.0s), 00/20 VUs, 12200 complete and 0 interrupted iterations
rps    [  81% ] 00/20 VUs  4m04.0s/5m0s  50.00 iters/s

running (4m05.0s), 00/20 VUs, 12250 complete and 0 interrupted iterations
rps    [  82% ] 00/20 VUs  4m05.0s/5m0s  50.00 iters/s

running (4m06.0s), 00/20 VUs, 12300 complete and 0 interrupted iterations
rps    [  82% ] 00/20 VUs  4m06.0s/5m0s  50.00 iters/s

running (4m07.0s), 00/20 VUs, 12350 complete and 0 interrupted iterations
rps    [  82% ] 00/20 VUs  4m07.0s/5m0s  50.00 iters/s

running (4m08.0s), 00/20 VUs, 12400 complete and 0 interrupted iterations
rps    [  83% ] 00/20 VUs  4m08.0s/5m0s  50.00 iters/s

running (4m09.0s), 00/20 VUs, 12450 complete and 0 interrupted iterations
rps    [  83% ] 00/20 VUs  4m09.0s/5m0s  50.00 iters/s

running (4m10.0s), 00/20 VUs, 12500 complete and 0 interrupted iterations
rps    [  83% ] 00/20 VUs  4m10.0s/5m0s  50.00 iters/s

running (4m11.0s), 00/20 VUs, 12550 complete and 0 interrupted iterations
rps    [  84% ] 00/20 VUs  4m11.0s/5m0s  50.00 iters/s

running (4m12.0s), 00/20 VUs, 12600 complete and 0 interrupted iterations
rps    [  84% ] 00/20 VUs  4m12.0s/5m0s  50.00 iters/s

running (4m13.0s), 00/20 VUs, 12650 complete and 0 interrupted iterations
rps    [  84% ] 00/20 VUs  4m13.0s/5m0s  50.00 iters/s

running (4m14.0s), 00/20 VUs, 12700 complete and 0 interrupted iterations
rps    [  85% ] 00/20 VUs  4m14.0s/5m0s  50.00 iters/s

running (4m15.0s), 00/20 VUs, 12750 complete and 0 interrupted iterations
rps    [  85% ] 00/20 VUs  4m15.0s/5m0s  50.00 iters/s

running (4m16.0s), 00/20 VUs, 12800 complete and 0 interrupted iterations
rps    [  85% ] 00/20 VUs  4m16.0s/5m0s  50.00 iters/s

running (4m17.0s), 00/20 VUs, 12850 complete and 0 interrupted iterations
rps    [  86% ] 00/20 VUs  4m17.0s/5m0s  50.00 iters/s

running (4m18.0s), 00/20 VUs, 12900 complete and 0 interrupted iterations
rps    [  86% ] 00/20 VUs  4m18.0s/5m0s  50.00 iters/s

running (4m19.0s), 00/20 VUs, 12950 complete and 0 interrupted iterations
rps    [  86% ] 00/20 VUs  4m19.0s/5m0s  50.00 iters/s

running (4m20.0s), 00/20 VUs, 13000 complete and 0 interrupted iterations
rps    [  87% ] 00/20 VUs  4m20.0s/5m0s  50.00 iters/s

running (4m21.0s), 00/20 VUs, 13050 complete and 0 interrupted iterations
rps    [  87% ] 00/20 VUs  4m21.0s/5m0s  50.00 iters/s

running (4m22.0s), 00/20 VUs, 13100 complete and 0 interrupted iterations
rps    [  87% ] 00/20 VUs  4m22.0s/5m0s  50.00 iters/s

running (4m23.0s), 00/20 VUs, 13150 complete and 0 interrupted iterations
rps    [  88% ] 00/20 VUs  4m23.0s/5m0s  50.00 iters/s

running (4m24.0s), 00/20 VUs, 13200 complete and 0 interrupted iterations
rps    [  88% ] 00/20 VUs  4m24.0s/5m0s  50.00 iters/s

running (4m25.0s), 00/20 VUs, 13250 complete and 0 interrupted iterations
rps    [  88% ] 00/20 VUs  4m25.0s/5m0s  50.00 iters/s

running (4m26.0s), 00/20 VUs, 13300 complete and 0 interrupted iterations
rps    [  89% ] 00/20 VUs  4m26.0s/5m0s  50.00 iters/s

running (4m27.0s), 00/20 VUs, 13350 complete and 0 interrupted iterations
rps    [  89% ] 00/20 VUs  4m27.0s/5m0s  50.00 iters/s

running (4m28.0s), 00/20 VUs, 13400 complete and 0 interrupted iterations
rps    [  89% ] 00/20 VUs  4m28.0s/5m0s  50.00 iters/s

running (4m29.0s), 00/20 VUs, 13450 complete and 0 interrupted iterations
rps    [  90% ] 00/20 VUs  4m29.0s/5m0s  50.00 iters/s

running (4m30.0s), 00/20 VUs, 13500 complete and 0 interrupted iterations
rps    [  90% ] 00/20 VUs  4m30.0s/5m0s  50.00 iters/s

running (4m31.0s), 00/20 VUs, 13550 complete and 0 interrupted iterations
rps    [  90% ] 00/20 VUs  4m31.0s/5m0s  50.00 iters/s

running (4m32.0s), 00/20 VUs, 13600 complete and 0 interrupted iterations
rps    [  91% ] 00/20 VUs  4m32.0s/5m0s  50.00 iters/s

running (4m33.0s), 00/20 VUs, 13650 complete and 0 interrupted iterations
rps    [  91% ] 00/20 VUs  4m33.0s/5m0s  50.00 iters/s

running (4m34.0s), 00/20 VUs, 13700 complete and 0 interrupted iterations
rps    [  91% ] 00/20 VUs  4m34.0s/5m0s  50.00 iters/s

running (4m35.0s), 00/20 VUs, 13750 complete and 0 interrupted iterations
rps    [  92% ] 00/20 VUs  4m35.0s/5m0s  50.00 iters/s

running (4m36.0s), 00/20 VUs, 13800 complete and 0 interrupted iterations
rps    [  92% ] 00/20 VUs  4m36.0s/5m0s  50.00 iters/s

running (4m37.0s), 00/20 VUs, 13850 complete and 0 interrupted iterations
rps    [  92% ] 00/20 VUs  4m37.0s/5m0s  50.00 iters/s

running (4m38.0s), 00/20 VUs, 13900 complete and 0 interrupted iterations
rps    [  93% ] 00/20 VUs  4m38.0s/5m0s  50.00 iters/s

running (4m39.0s), 00/20 VUs, 13950 complete and 0 interrupted iterations
rps    [  93% ] 00/20 VUs  4m39.0s/5m0s  50.00 iters/s

running (4m40.0s), 00/20 VUs, 14000 complete and 0 interrupted iterations
rps    [  93% ] 00/20 VUs  4m40.0s/5m0s  50.00 iters/s

running (4m41.0s), 00/20 VUs, 14050 complete and 0 interrupted iterations
rps    [  94% ] 00/20 VUs  4m41.0s/5m0s  50.00 iters/s

running (4m42.0s), 00/20 VUs, 14100 complete and 0 interrupted iterations
rps    [  94% ] 00/20 VUs  4m42.0s/5m0s  50.00 iters/s

running (4m43.0s), 00/20 VUs, 14150 complete and 0 interrupted iterations
rps    [  94% ] 00/20 VUs  4m43.0s/5m0s  50.00 iters/s

running (4m44.0s), 00/20 VUs, 14200 complete and 0 interrupted iterations
rps    [  95% ] 00/20 VUs  4m44.0s/5m0s  50.00 iters/s

running (4m45.0s), 00/20 VUs, 14250 complete and 0 interrupted iterations
rps    [  95% ] 00/20 VUs  4m45.0s/5m0s  50.00 iters/s

running (4m46.0s), 00/20 VUs, 14300 complete and 0 interrupted iterations
rps    [  95% ] 00/20 VUs  4m46.0s/5m0s  50.00 iters/s

running (4m47.0s), 00/20 VUs, 14350 complete and 0 interrupted iterations
rps    [  96% ] 00/20 VUs  4m47.0s/5m0s  50.00 iters/s

running (4m48.0s), 00/20 VUs, 14400 complete and 0 interrupted iterations
rps    [  96% ] 00/20 VUs  4m48.0s/5m0s  50.00 iters/s

running (4m49.0s), 00/20 VUs, 14450 complete and 0 interrupted iterations
rps    [  96% ] 00/20 VUs  4m49.0s/5m0s  50.00 iters/s

running (4m50.0s), 00/20 VUs, 14500 complete and 0 interrupted iterations
rps    [  97% ] 00/20 VUs  4m50.0s/5m0s  50.00 iters/s

running (4m51.0s), 00/20 VUs, 14550 complete and 0 interrupted iterations
rps    [  97% ] 00/20 VUs  4m51.0s/5m0s  50.00 iters/s

running (4m52.0s), 00/20 VUs, 14600 complete and 0 interrupted iterations
rps    [  97% ] 00/20 VUs  4m52.0s/5m0s  50.00 iters/s

running (4m53.0s), 00/20 VUs, 14650 complete and 0 interrupted iterations
rps    [  98% ] 00/20 VUs  4m53.0s/5m0s  50.00 iters/s

running (4m54.0s), 00/20 VUs, 14700 complete and 0 interrupted iterations
rps    [  98% ] 00/20 VUs  4m54.0s/5m0s  50.00 iters/s

running (4m55.0s), 00/20 VUs, 14750 complete and 0 interrupted iterations
rps    [  98% ] 00/20 VUs  4m55.0s/5m0s  50.00 iters/s

running (4m56.0s), 00/20 VUs, 14800 complete and 0 interrupted iterations
rps    [  99% ] 00/20 VUs  4m56.0s/5m0s  50.00 iters/s

running (4m57.0s), 00/20 VUs, 14850 complete and 0 interrupted iterations
rps    [  99% ] 00/20 VUs  4m57.0s/5m0s  50.00 iters/s

running (4m58.0s), 00/20 VUs, 14900 complete and 0 interrupted iterations
rps    [  99% ] 00/20 VUs  4m58.0s/5m0s  50.00 iters/s

running (4m59.0s), 00/20 VUs, 14950 complete and 0 interrupted iterations
rps    [ 100% ] 00/20 VUs  4m59.0s/5m0s  50.00 iters/s

running (5m00.0s), 00/20 VUs, 15000 complete and 0 interrupted iterations
rps    [ 100% ] 00/20 VUs  5m00.0s/5m0s  50.00 iters/s


  █ THRESHOLDS 

    http_req_duration
    ✓ 'p(95)<300' p(95)=3.41ms

    http_req_failed
    ✓ 'rate<0.01' rate=0.00%


  █ TOTAL RESULTS 

    checks_total.......: 15001   50.004859/s
    checks_succeeded...: 100.00% 15001 out of 15001
    checks_failed......: 0.00%   0 out of 15001

    ✓ status 200

    HTTP
    http_req_duration..............: avg=2.55ms min=1.55ms med=2.47ms max=18.08ms p(90)=3.11ms p(95)=3.41ms
      { expected_response:true }...: avg=2.55ms min=1.55ms med=2.47ms max=18.08ms p(90)=3.11ms p(95)=3.41ms
    http_req_failed................: 0.00%  0 out of 15001
    http_reqs......................: 15001  50.004859/s

    EXECUTION
    iteration_duration.............: avg=2.73ms min=1.66ms med=2.64ms max=20.77ms p(90)=3.32ms p(95)=3.63ms
    iterations.....................: 15001  50.004859/s
    vus............................: 0      min=0          max=0 
    vus_max........................: 20     min=20         max=20

    NETWORK
    data_received..................: 2.7 MB 8.9 kB/s
    data_sent......................: 551 kB 1.8 kB/s




running (5m00.0s), 00/20 VUs, 15001 complete and 0 interrupted iterations
rps  ✓ [ 100% ] 00/20 VUs  5m0s  50.00 iters/s
